{"iteration": 0, "layer": 0, "mutation_type": "baseline", "description": "baseline run", "pass_rate": 0.62, "delta": 0.0, "decision": "BASELINE", "oracle_runs": 24, "tokens": 14000, "duration_seconds": 110.0, "cost_usd": 0.48, "regressions": [], "timestamp": "2026-08-01T12:00:00+00:00"}
{"iteration": 1, "layer": 1, "mutation_type": "disambiguation", "description": "name the period explicitly", "pass_rate": 0.66, "delta": 0.04, "decision": "KEEP", "oracle_runs": 30, "tokens": 17000, "duration_seconds": 132.0, "cost_usd": 0.59, "regressions": [], "timestamp": "2026-08-01T12:00:00+00:00", "mutation_family": "disambiguation", "predicted_effect": "case-01 and case-04 flip to PASS", "prediction_correct": true}
{"iteration": 2, "layer": 1, "mutation_type": "constraint", "description": "require units on every figure", "pass_rate": 0.62, "delta": -0.04, "decision": "DISCARD", "oracle_runs": 30, "tokens": 17500, "duration_seconds": 135.0, "cost_usd": 0.61, "regressions": [], "timestamp": "2026-08-01T12:00:00+00:00", "mutation_family": "constraint-tightening", "predicted_effect": "case-05 and case-08 flip to PASS", "prediction_correct": false}
{"iteration": 3, "layer": 1, "mutation_type": "disambiguation", "description": "distinguish trend from point value", "pass_rate": 0.74, "delta": 0.08, "decision": "KEEP", "oracle_runs": 30, "tokens": 18000, "duration_seconds": 140.0, "cost_usd": 0.63, "regressions": [], "timestamp": "2026-08-01T12:00:00+00:00", "mutation_family": "disambiguation", "predicted_effect": "case-09 flips to PASS", "prediction_correct": false}
{"iteration": 4, "layer": 1, "mutation_type": "constraint", "description": "cap summary length", "pass_rate": 0.74, "delta": 0.0, "decision": "DISCARD", "oracle_runs": 30, "tokens": 18200, "duration_seconds": 141.0, "cost_usd": 0.64, "regressions": [], "timestamp": "2026-08-01T12:00:00+00:00", "mutation_family": "constraint-tightening", "predicted_effect": "case-07 flips to PASS", "prediction_correct": false}
{"iteration": 5, "layer": 1, "mutation_type": "disambiguation", "description": "spell out risk enumeration format", "pass_rate": 0.78, "delta": 0.04, "decision": "KEEP", "oracle_runs": 30, "tokens": 19000, "duration_seconds": 148.0, "cost_usd": 0.67, "regressions": [], "timestamp": "2026-08-01T12:00:00+00:00", "mutation_family": "disambiguation", "predicted_effect": "case-03 flips to PASS", "prediction_correct": true}
{"iteration": 6, "layer": 1, "mutation_type": "constraint", "description": "demand explicit no-flag statement", "pass_rate": 0.81, "delta": 0.03, "decision": "KEEP", "oracle_runs": 30, "tokens": 19500, "duration_seconds": 151.0, "cost_usd": 0.69, "regressions": [], "timestamp": "2026-08-01T12:00:00+00:00", "mutation_family": "constraint-tightening", "predicted_effect": "case-10 flips to PASS", "prediction_correct": true}
